<?xml version="1.0" encoding="UTF-8"?>
<!DOCTYPE branches SYSTEM "branches.dtd">
<branches>
  <branch>
    <address>76 Devonshire St</address>
    <suburb>Surry Hills NSW</suburb>
    <phone>02 9211 1234</phone>
    <openingHours>
      <day name="Mon - Fri">6:00 to 14:30</day>
      <day name="Sat - Sun">7:00 to 15:00</day>
    </openingHours>
    <mapLink>https://maps.google.com/?q=76+Devonshire+St+Surry+Hills+NSW</mapLink>
  </branch>
  <branch>
    <address>451 Pitt St</address>
    <suburb>Haymarket Sydney NSW</suburb>
    <phone>02 9262 5678</phone>
    <openingHours>
      <day name="Mon - Fri">6:00 to 16:00</day>
      <day name="Sat - Sun">7:00 to 15:00</day>
    </openingHours>
    <mapLink>https://maps.google.com/?q=451+Pitt+St+Haymarket+Sydney+NSW</mapLink>
  </branch>
  <branch>
    <address>31 Alfred Street</address>
    <suburb>Circular Quay NSW</suburb>
    <phone>02 8971 9101</phone>
    <openingHours>
      <day name="Mon - Fri">6:00 to 16:00</day>
      <day name="Sat - Sun">7:00 to 15:00</day>
    </openingHours>
    <mapLink>https://maps.google.com/?q=31+Alfred+Street+Circular+Quay+NSW</mapLink>
  </branch>
</branches>
